[
  {
    "id": "villa",
    "name_ar": "فيلا",
    "name_en": "Villa",
    "category": "سكني",
    "legal_definition_ar": "وحدة سكنية مستقلة مبنية على قطعة أرض خاصة، تتكون عادةً من دورين أو أكثر، ولها مدخل مستقل وحديقة أو فناء خاص. تُعدّ الفيلا من أكثر أنواع العقارات السكنية انتشاراً في المملكة وتخضع لاشتراطات البناء البلدية المعتمدة.",
    "legal_definition_en": "A standalone residential unit built on a private plot, typically comprising two or more floors with an independent entrance and private garden or courtyard. Villas are among the most common residential property types in Saudi Arabia and are subject to approved municipal building requirements.",
    "deed_type_ar": "صك ملكية عقارية يشمل الأرض والمبنى",
    "permitted_uses_ar": ["السكن الخاص", "الإيجار السكني بعقد موثق في إيجار", "البيع والتملك"],
    "restrictions_ar": ["لا يُسمح بالاستخدام التجاري أو الصناعي إلا بترخيص بلدي خاص", "يخضع البناء لاشتراطات الكود السعودي للبناء SBC", "يستلزم الحصول على رخصة بناء قبل الإنشاء أو التعديل"],
    "typical_ownership_ar": "ملكية فردية",
    "foreign_ownership_allowed": "مشروط",
    "registration_platform_ar": "وزارة العدل عبر منظومة التسجيل العيني للعقار (ريدز)",
    "audience": ["مالك", "مستأجر", "مستثمر", "وسيط"],
    "source_url": "https://www.rega.gov.sa/ar/services/real-estate-registration",
    "last_verified": "2026-05-21"
  },
  {
    "id": "apartment",
    "name_ar": "شقة",
    "name_en": "Apartment",
    "category": "سكني",
    "legal_definition_ar": "وحدة سكنية ضمن مبنى متعدد الطوابق تتكون من غرف وصالة ومرافق ضمن حدود محددة، وتخضع لنظام الملكية المشتركة الذي يُنظّم حقوق الملاك في الأجزاء المشتركة من المبنى كالمداخل والأدراج والمصاعد.",
    "legal_definition_en": "A residential unit within a multi-story building comprising rooms, a living area, and amenities within defined boundaries. Governed by the joint ownership system that regulates owners' rights in shared building areas such as entrances, stairways, and elevators.",
    "deed_type_ar": "صك ملكية مشتركة وفق نظام الوحدات العقارية",
    "permitted_uses_ar": ["السكن الخاص", "الإيجار السكني بعقد موثق في إيجار", "البيع والتملك"],
    "restrictions_ar": ["يخضع للوائح نظام الملكية المشتركة الصادر عن هيئة العقار", "لا يُسمح بالاستخدام التجاري إلا بترخيص مناسب", "تخضع الأجزاء المشتركة لإدارة جمعية الملاك أو الوحدة الإدارية"],
    "typical_ownership_ar": "ملكية مشتركة",
    "foreign_ownership_allowed": "مشروط",
    "registration_platform_ar": "وزارة العدل عبر منظومة التسجيل العيني للعقار (ريدز)",
    "audience": ["مالك", "مستأجر", "مستثمر", "وسيط"],
    "source_url": "https://www.rega.gov.sa/ar/services/real-estate-registration",
    "last_verified": "2026-05-21"
  },
  {
    "id": "floor_unit",
    "name_ar": "دور",
    "name_en": "Floor Unit",
    "category": "سكني",
    "legal_definition_ar": "وحدة سكنية تشغل طابقاً كاملاً أو جزءاً كبيراً منه في مبنى سكني، وتتميز عادةً بمساحة أكبر من الشقة التقليدية وقد يكون لها مدخل مستقل أو درج خاص، وتخضع لنظام الملكية المشتركة مع سائر ملاك الطوابق الأخرى في المبنى.",
    "legal_definition_en": "A residential unit occupying a full floor or large portion thereof in a residential building. Typically larger than a conventional apartment and may have an independent entrance or private staircase. Subject to the joint ownership system alongside owners of other floors.",
    "deed_type_ar": "صك ملكية مشتركة وفق نظام الوحدات العقارية",
    "permitted_uses_ar": ["السكن الخاص", "الإيجار السكني بعقد موثق في إيجار"],
    "restrictions_ar": ["يخضع لنظام الملكية المشتركة", "لا يُسمح بالاستخدام التجاري إلا بترخيص مناسب"],
    "typical_ownership_ar": "ملكية مشتركة",
    "foreign_ownership_allowed": "مشروط",
    "registration_platform_ar": "وزارة العدل عبر منظومة التسجيل العيني للعقار (ريدز)",
    "audience": ["مالك", "مستأجر", "وسيط"],
    "source_url": "https://www.rega.gov.sa/ar/services/real-estate-registration",
    "last_verified": "2026-05-21"
  },
  {
    "id": "rest_house",
    "name_ar": "استراحة",
    "name_en": "Rest House",
    "category": "سكني",
    "legal_definition_ar": "منشأة ترفيهية وسكنية مؤقتة تُقام عادةً خارج النطاق العمراني أو في أطراف المدن، ومصممة للاستخدام الترفيهي والتجمعات العائلية وليس كمسكن دائم. تستلزم الحصول على ترخيص بلدي خاص وتخضع لاشتراطات الاستخدام المحددة من الأمانة أو البلدية المختصة.",
    "legal_definition_en": "A recreational and temporary residential facility typically located outside or on the outskirts of urban areas, designed for leisure and family gatherings rather than permanent residence. Requires a special municipal permit and is subject to usage requirements set by the relevant municipality.",
    "deed_type_ar": "صك ملكية للأرض مع ترخيص بلدي للمنشأة",
    "permitted_uses_ar": ["الترفيه وتجمعات الأسرة", "الإيجار الترفيهي المرخص"],
    "restrictions_ar": ["لا تُستخدم كمسكن دائم بموجب الاشتراطات البلدية", "تستلزم الحصول على ترخيص بلدي للمنشأة", "يخضع الإيجار لعقد موثق في منصة إيجار"],
    "typical_ownership_ar": "ملكية فردية",
    "foreign_ownership_allowed": false,
    "registration_platform_ar": "الأمانة أو البلدية المختصة للترخيص — وزارة العدل لتسجيل الأرض",
    "audience": ["مالك", "مستأجر"],
    "source_url": "https://mc.gov.sa/ar/Pages/default.aspx",
    "last_verified": "2026-05-21"
  },
  {
    "id": "furnished_apartment",
    "name_ar": "شقة مفروشة",
    "name_en": "Furnished Apartment",
    "category": "سكني",
    "legal_definition_ar": "وحدة سكنية مُجهَّزة بالأثاث والأجهزة الكهربائية ومستلزمات الإقامة، مرخَّصة من هيئة السياحة لتقديم خدمات الإيجار اليومي أو الأسبوعي أو الشهري. تخضع لأنظمة السياحة والضيافة بالإضافة إلى نظام الإيجار، وتُعدّ تجارياً مستقلة عن الشقة السكنية العادية.",
    "legal_definition_en": "A residential unit fully furnished with furniture, appliances, and accommodation essentials, licensed by the Tourism Authority for daily, weekly, or monthly rental services. Subject to tourism and hospitality regulations in addition to tenancy law, and commercially distinct from standard residential apartments.",
    "deed_type_ar": "صك ملكية مشتركة مع ترخيص سياحي من هيئة السياحة",
    "permitted_uses_ar": ["الإيجار اليومي والأسبوعي والشهري المرخص", "الإقامة المؤقتة"],
    "restrictions_ar": ["يستلزم ترخيصاً سياحياً من الهيئة السعودية للسياحة", "تسري عليها ضريبة القيمة المضافة على خدمات الإيجار", "يختلف عقد إيجارها عن عقد الشقة السكنية الاعتيادية"],
    "typical_ownership_ar": "ملكية مشتركة",
    "foreign_ownership_allowed": "مشروط",
    "registration_platform_ar": "هيئة السياحة للترخيص — منصة إيجار للعقود",
    "audience": ["مالك", "مستأجر", "مستثمر"],
    "source_url": "https://sta.gov.sa/ar/services/licenses",
    "last_verified": "2026-05-21"
  },
  {
    "id": "retail_unit",
    "name_ar": "محل تجاري",
    "name_en": "Retail Unit",
    "category": "تجاري",
    "legal_definition_ar": "وحدة تجارية في مبنى تجاري أو مجمع تجاري مرخَّص، مخصصة لممارسة التجزئة أو تقديم الخدمات التجارية. تستلزم ترخيصاً تجارياً من وزارة التجارة وقد تشترط رخصة بلدية إضافية وفق نشاط المحل وموقعه.",
    "legal_definition_en": "A commercial unit within a licensed commercial building or mall, designated for retail activity or commercial service delivery. Requires a commercial license from the Ministry of Commerce, and may require additional municipal permits depending on the business activity and location.",
    "deed_type_ar": "صك ملكية تجارية مشتركة",
    "permitted_uses_ar": ["التجزئة والبيع المباشر", "تقديم الخدمات التجارية المرخصة"],
    "restrictions_ar": ["يستلزم ترخيصاً تجارياً ساري المفعول", "يخضع لاشتراطات الدفاع المدني وتصاريح البلدية", "لا يُسمح بالاستخدام السكني"],
    "typical_ownership_ar": "ملكية مشتركة",
    "foreign_ownership_allowed": "مشروط",
    "registration_platform_ar": "وزارة العدل للتسجيل — وزارة التجارة للترخيص التجاري",
    "audience": ["مستثمر", "مالك", "وسيط", "مطور"],
    "source_url": "https://www.rega.gov.sa/ar/regulations/commercial-real-estate",
    "last_verified": "2026-05-21"
  },
  {
    "id": "office_unit",
    "name_ar": "مكتب",
    "name_en": "Office Unit",
    "category": "تجاري",
    "legal_definition_ar": "وحدة في مبنى إداري مرخَّص مخصصة لممارسة الأعمال الإدارية والمهنية. يتميز المبنى الإداري عن التجاري في طبيعة الاستخدام واشتراطات الترخيص والتصنيف البلدي؛ إذ يُخصص المبنى الإداري للنشاط المكتبي بينما يستوعب التجاري أنشطة البيع والخدمات.",
    "legal_definition_en": "A unit in a licensed administrative building designated for business and professional activities. Administrative buildings differ from commercial ones in usage type, licensing requirements, and municipal classification; administrative buildings serve office-based activities while commercial buildings accommodate retail and services.",
    "deed_type_ar": "صك ملكية إدارية مشتركة",
    "permitted_uses_ar": ["الأعمال الإدارية والمكتبية", "الخدمات المهنية المرخصة", "المقرات الرئيسية للشركات"],
    "restrictions_ar": ["لا يُسمح بالاستخدام السكني", "يستلزم اشتراطات الدفاع المدني للمباني الإدارية", "يخضع لاشتراطات ترخيص البلدية المختصة"],
    "typical_ownership_ar": "ملكية مشتركة",
    "foreign_ownership_allowed": "مشروط",
    "registration_platform_ar": "وزارة العدل للتسجيل — البلدية للترخيص الإداري",
    "audience": ["مستثمر", "مالك", "وسيط", "مطور"],
    "source_url": "https://www.rega.gov.sa/ar/regulations/commercial-real-estate",
    "last_verified": "2026-05-21"
  },
  {
    "id": "warehouse",
    "name_ar": "مستودع",
    "name_en": "Warehouse",
    "category": "صناعي",
    "legal_definition_ar": "منشأة مخصصة لتخزين البضائع والمواد، تقع عادةً في المناطق الصناعية أو اللوجستية المرخصة. تستلزم تصاريح إنشاء من الهيئة السعودية للمدن الصناعية (مدن) أو البلدية المختصة، إضافةً إلى اشتراطات السلامة من الدفاع المدني وفق نوع البضائع المخزنة.",
    "legal_definition_en": "A facility designated for storing goods and materials, typically located in licensed industrial or logistics zones. Requires construction permits from the Saudi Industrial Cities Authority (MODON) or the competent municipality, plus civil defense safety requirements based on the type of goods stored.",